date,title,link,content,sentiment,evaluation,result,hannanum_tokens
2024-11-19 20:17:15,경찰서 앞에 모인 여대생‥'붉은 시위'에 멍든 대학가,https://n.news.naver.com/mnews/article/214/0001387564?sid=102,"[뉴스데스크]◀ 앵커 ▶서울여대 학생들이 성추행으로 징계를 받은 교수에 대한 추가 징계와 재발 방지를 요구하며 시위를 벌였습니다.그런데 해당 교수가 이 사안 공론화에 나선 학생들을 고소하면서 반발은 더 거세지고 있는데요.일부 학생들은 '스프레이'로 학교 곳곳에 항의 문구를 적는 시위에 나서기도 했습니다.송정훈 기자가 보도합니다.◀ 리포트 ▶서울여대 학생 5백여 명이 경찰서 앞을 가득 메웠습니다.""학생을 고소하는 대학교수 웬 말이냐!""학생을 성추행한 인문대 교수에게 내려진 '감봉 3개월' 징계가 '솜방망이'라는 대자보를 붙인 데 대해, 해당 교수가 학생들을 명예훼손으로 고소하면서 분노한 학생들이 모인 겁니다.[서울여대 학생]""다른 피해자가 생기지 않기를 바라는 마음으로 용기 낸 학생들에게 무슨 죄가 있다는 말입니까?""해당 교수의 연구실에는 계란과 밀가루·고추장이 던져졌고, 캠퍼스 곳곳에는 '성범죄자는 나가'라는 붉은 글씨가 새겨졌습니다.해당 교수는 비대면 강의로 전환하고 학교에 나오지 않고 있고, 학교 측은 외부 법률전문가가 참여하는 비상대책위원회까지 꾸렸지만, 학생들은 학교의 대응이 여전히 소극적이고 충분하지 않다고 보고 있습니다.[피해 학생 (음성 변조)]""1차적으로 학생을 고소했다는 것 자체에 대해서 본인의 범죄 행위를 부인하는 행위라 느껴져서 너무 화가 났었고요. 2차적으로는 제 스스로가 부정당하는 느낌이었어요.""결국 귀닫은 학교에 분노와 항의의 목소리를 전하기 위해 래커 스프레이 시위에 나설 수 밖에 없었다는 겁니다.[서울여대 학생 (음성 변조)]""학교 본부 측에서 계속 대답을 안 했다는 것, 그게 좀 핵심인 것 같아요. 그러다가 이제 래커 시위를 하고 나서야 이제 입장을 낸 거잖아요.""반면 학교 한켠에서는 시위 방법에 대한 우려의 목소리도 나옵니다.시위의 이유는 다르지만, 동덕여대에서도 일방적인 남여공학 전환 추진에 대해 항의에 나선 학생들이 학교 시설물을 래커 스프레이로 칠하면서 논란이 일고 있습니다.""학교 건물까지 훼손하면서 시위하는 건 오히려 일을 키우는 것 같다"" ""학교 측에 화가 나지만 흑백으로 갈라치는 방식은 잘못됐다""는 말도 나옵니다.동덕여대나 서울여대 학교 측은 사태해결과 별개로, 시설물 훼손에 대해선 손해배상을 청구하겠다는 방침이어서, 갈등이 증폭되는 거 아니냐는 우려도 나오고 있습니다.MBC뉴스 송정훈입니다.영상취재: 한재훈 / 영상편집: 이지영MBC 뉴스는 24시간 여러분의 제보를 기다립니다.▷ 전화 02-784-4000▷ 이메일 mbcjebo@mbc.co.kr▷ 카카오톡 @mbc제보",0.0,1,긍정,"['[뉴스데스크]◀', '앵커', '▶서울여대', '학생들', '이', '성추행', '으로', '징계', '를', '받', '은', '교수', '에', '대하', 'ㄴ', '추', '가', '징계', '와', '재발', '방지', '를', '요구', '하', '며', '시위', '를', '벌이', '었습니다', '.', '그런데', '해당', '교수', '가', '이', '사안', '공론화', '에', '나서', 'ㄴ', '학생들', '을', '고소', '하', '면서', '반발', '은', '더', '거세', '이', '지', '고', '있', '는데', '요', '.', '일부', '학생들', '은', ""'"", '스프레이', ""'"", '로', '학교', '곳곳', '에', '항의', '문구', '를', '적', '는', '시위', '에', '나서', '기', '도', '하', '었습니다', '.', '송정훈', '기자', '가', '보도', '하', 'ㅂ니다', '.', '◀', '리포트', '▶서울여대', '학생', '5백여', '명', '이', '경찰', '서', '앞', '을', '가득', '메우', '었습니다', '.""', '학생', '을', '고소', '하', '는', '대학교수', '웬', '말', '이', '냐', '!""', '학생', '을', '성추행한', '인문대', '교수', '에게', '내리', '어', '지', 'ㄴ', ""'"", '감봉', '3개월', ""'"", '징계', '가', ""'"", '솜방망이', ""'"", '라는', '대자보', '를', '붙이', 'ㄴ', '데', '대', '어', '하', '어', ',', '해당', '교수', '가', '학생들', '을', '명예훼손', '으로', '고소', '하', '면서', '분노', '하', 'ㄴ', '학생들', '이', '모이', 'ㄴ', '거', 'ㅂ니다', '.', '[서울여대', '학생', ']""', '다른', '피해자', '가', '생기', '지', '않', '기', '를', '바라', '는', '마음', '으로', '용기', '내', 'ㄴ', '학생들', '에게', '무슨', '죄', '가', '있', '다는', '말', '이', 'ㅂ니까', '?""', '해당', '교수', '의', '연구실', '에는', '계란', '과', '밀가루·고추장', '이', '던지', '어', '지', '었고', ',', '캠퍼스', '곳곳', '에는', ""'"", '성범죄자', '는', '나', '가', ""'"", '라는', '붉', '은', '글씨', '가', '새기', '어', '지', '었습니다', '.', '해당', '교수', '는', '비대', '이', '면', '강의', '로', '전환', '하고', '학교', '에', '나오', '지', '않', '고', '있', '고', ',', '학교', '측은', '외부', '법률전문가', '가', '참여', '하', '는', '비상대책위원회', '까지', '꾸리', '었지만', ',', '학생들', '은', '학교', '의', '대응', '이', '여전히', '소극적', '이', '고', '충분', '하', '지', '않', '다', '고', '보', '고', '있', '습니다', '.', '[', '피하', '어', '학생', '(', '음성', '변조)]""1차적', '으로', '학생', '을', '고소', '하', '었다는', '것', '자체', '에', '대하', '어서', '본인', '의', '범죄', '행위', '를', '부인', '하', '는', '행위', '이', '라', '느끼', '어', '지', '어서', '너무', '화', '가', '나', '아고요', '.', '2차적으로', '는', '저', '의', '스스로', '가', '부정', '당하', '는', '느낌', '이', '었어', '요', '.""', '결국', '귀닫', '은', '학교', '에', '분노', '와', '항의', '의', '목소리', '를', '전하', '기', '위하', '어', '래커', '스프레이', '시위', '에', '나서', 'ㄹ', '수', '밖', '에', '없', '었다는', '거', 'ㅂ니다', '.', '[서울여대', '학생', '(', '음성', '변조', ')]""', '학교', '본부', '측', '에서', '계속', '대답', '을', '안', '하', '었다는', '것', ',', '그', '이', '게', '좀', '핵심', '이', 'ㄴ', '것', '같', '아', '요', '.', '그러', '다가', '이제', '래커', '시위', '를', '하', '고', '나', '아', '이제', '입장', '을', '내', 'ㄴ', '거잖아요', '.""', '반면', '학교', '하', 'ㄴ', '켠', '에서는', '시위', '방법', '에', '대하', 'ㄴ', '우려', '의', '목소리', '도', '나', '아', '오', 'ㅂ니다', '.', '시위', '의', '이유', '는', '다르', '지', '말', 'ㄴ', ',', '동덕여대에서', '도', '일방적', '이', 'ㄴ', '남여공학', '전환', '추진', '에', '대', '어', '하', '어', '항의', '에', '나서', 'ㄴ', '학생들', '이', '학교', '시설물', '을', '래커', '스프레이', '로', '칠하', '면서', '논란', '이', '일', '고', '있', '습니다', '.""', '학교', '건물', '까지', '훼손', '하', '면서', '시위', '하', '는', '거', '은', '오히려', '일', '을', '키우', '는', '것', '같', '다', '""', '""', '학교', '측', '에', '화', '가', '나', '지', '말', 'ㄴ', '흑백', '으로', '갈라치', '는', '방식', '은', '잘못', '되', '었다', '""', '는', '말', '도', '나', '아', '오', 'ㅂ니다', '.', '동덕여대', '나', '서울여대', '학교', '측은', '사태해결', '과', '별개', '로', ',', '시설물', '훼손', '에', '대', '어', '하', '어서ㄴ', '손해배상', '을', '청구', '하', '겠다는', '방침', '이', '어서', ',', '가', 'ㄹ', '등', '이', '증폭', '되', '는', '것', '아니', '냐는', '우', '이', '리어도', '나', '아', '오', '고', '있', '습니다', '.', 'MBC', '뉴스', '송정훈', '이', 'ㅂ니다', '.', '영상취재', ':', '한재훈', '/', '영상편집', ':', '이지영MBC', '뉴스', '는', '24시간', '여러분', '의', '제보', '를', '기다리', 'ㅂ니다', '.', '▷', '전화', '02-784-4000▷', '이메', '이', 'ㄹ', 'mbcjebo', '@', 'mbc', '.', 'co', '.', 'kr▷', '카카오톡', '@mbc제보']"
2024-11-19 19:39:58,“평화 시위 소득 없어” vs “래커 시위에 피해”,https://n.news.naver.com/mnews/article/449/0000291446?sid=102,"[앵커]동덕여대에서 시작한 남녀공학 반대 시위가, 다른 여대로 확산하고 있습니다.공학으로 바꾸느냐 마느냐도 논란이지만, 의사표현 방법과 시위 방식을 놓고도 갑론을박이 이어지고 있습니다.권경문 기자가 취재했습니다.[기자]캠퍼스 한가운데 근조 화환과 대학 점퍼가 놓여있습니다.동덕여대 백주년기념관 앞입니다.외벽에 붉은색 래커로 쓴 공학 전환 반대 문구가 써져있고요.건물 바닥에도 시위 구호 등이 래커로 빼곡하게 새겨져있습니다.출입문 유리와 문을 막는 책상 위에도 커다란 붉은색 엑스자 표시가 선명하게 보입니다.내년도 국제학부에 외국인 남학생 입학을 허용한 성신여대에도 건물과 바닥에 공학 추진 반대 문구가 래커로 적혀있습니다.서울 지역 여대를 중심으로 비슷한 시위 방식이 퍼지고 있습니다.다른 방식의 호소는 소용이 없었다며 옹호하는 목소리도 있습니다.[동덕여대 재학생]""저희는 작년에 이미 다른 외부 사람들이 말하는 일종의 평화 시위를 했는데 아무것도 지켜진 게 없었잖아요.""다른 학생의 피해를 외면하지 말라는 비판 목소리도 나옵니다.[성신여대 재학생]""다른 사람들까지 학교를 다니고 있는데 그 사람들까지 피해 보게 학교에 다 래커칠하고 시위하고 하는 모습이…""현재의 시위 방식에 반대하는 재학생팀이라고 주장하는 SNS 계정도 등장했습니다.학령인구 감소와 재정 부담 등으로 남녀 공학 전환을 검토하는 여대는 늘고 있습니다.[동덕여대 관계자]""공연예대 같은 경우는 남자 배우, 남자 무용수의 필요성이 제기된 바 있고요…""성신여대는 2013년 국제학부에 외국인 유학생을 유치하며 남학생 편입을 받아준 걸 유지하고 있을 뿐이라며 남녀 공학 전환에 대해 선을 그었습니다.채널A 뉴스 권경문입니다.영상취재: 정기섭영상편집: 형새봄",0.0,1,긍정,"['[앵커]동덕여대', '에서', '시작', '하', 'ㄴ', '남녀공학', '반대', '시위', '가', ',', '다른', '여', '대로', '확산', '하고', '있', '습니다', '.', '공학', '으로', '바꾸', '느냐', '말', '느냐', '도', '논란', '이', '지만', ',', '의사표현', '방법', '과', '시위', '방식', '을', '놓', '고', '도', '갑론을박', '이', '잇', '어', '지', '고', '있', '습니다', '.', '권', '경', '문', '기자', '가', '취재', '하', '었습니다', '.', '[', '기자', ']', '캠퍼스', '한가운데', '근조', '화환', '과', '대학', '점퍼', '가', '놓이', '어', '있', '습니다', '.', '동덕여대', '백주년기념관', '앞', '이', 'ㅂ니다', '.', '외벽', '에', '붉은색', '래커', '로', '쓰', 'ㄴ', '공학', '전환', '반대', '문구', '가', '쓰', '어', '지', '어', '있', '고요', '.', '건물', '바닥', '에도', '시위', '구호', '등', '이', '래커', '로', '빼곡하', '이', '게', '새기', '어', '지', '어', '있', '습니다', '.', '출입문', '유리', '와', '문', '을', '막', '는', '책상', '위', '에도', '커다랗', '은', '붉은색', '엑스', '이', '자', '표시', '가', '선명', '하', '게', '보이', 'ㅂ니다', '.', '내년', '도', '국제학부', '에', '외국', '이', 'ㄴ', '남학생', '입학', '을', '허용', '하', 'ㄴ', '성신여대에도\xa0건물', '과', '바닥', '에', '공학', '추진', '반대', '문구', '가', '래커', '로', '적히', '어', '있', '습니다', '.', '서울', '지역', '여대', '를', '중심', '으로', '비슷', '하', 'ㄴ', '시위', '방식', '이', '푸', '어', '지', '고', '있', '습니다', '.', '다른', '방식', '의', '호소', '는', '소용', '이', '없', '었다며', '옹호', '하', '는', '목소리', '도', '있', '습니다', '.', '[동덕여대', '재학생', ']""', '저희', '는', '작년', '에', '이미', '다른', '외부', '사람', '들', '이', '말', '하', '는', '일종', '의', '평화', '시위', '를', '하', '었는데', '아무것', '도', '지키', '어', '지', 'ㄴ', '것', '이', '없', '었잖아', '요', '.""', '다른', '학생', '의', '피해', '를', '외면', '하', '지', '말', '라는', '비판', '목소리', '도', '나', '아', '오', 'ㅂ니다', '.', '[성신여대', '재학생', ']""', '다른', '사람들', '까지', '학교', '를', '다니', '고', '있', '는데', '그', '사람들', '까지', '피하', '어', '보', '게', '학교', '에', '다', '래커칠하', '이', '고', '시위', '하고', '하', '는', '모습이…""현재', '의', '시위', '방식', '에', '반대', '하', '는', '재학생팀', '이', '라', '고', '주장', '하', '는', 'SNS', '계정', '도', '등장', '하', '었습니다', '.', '학령인구', '감소', '와', '재정', '부담', '등', '으로', '남녀', '공학', '전환', '을', '검토', '하', '는', '여대', '는', '늘', '고', '있', '습니다', '.', '[동덕여대', '관계자]""공연예대', '같', '은', '경우', '는', '남자', '배우', ',', '남자', '무용수', '의', '필요성', '이', '제기', '되', 'ㄴ', '바', '있고요…""성신여대', '는', '2013년', '국제학부', '에', '외국', '이', 'ㄴ', '유학생', '을', '유치', '하', '며', '남학생', '편입', '을', '받', '아', '주', 'ㄴ', '거', 'ㄹ', '유지', '하고', '있', '을', '뿐', '이', '라며', '남녀', '공학', '전환', '에', '대', '어', '하', '어', '선', '을', '그', '이', '었습니다', '.', '채널A', '뉴스', '권', '경', '문', '이', 'ㅂ니다', '.', '영상취재', ':', '정기섭영상편집:', '형새봄']"
2024-11-19 19:39:09,"""성폭력 의혹 교수가 왜 학생 고소""…450명 서울여대생 경찰 찾은 이유는",https://n.news.naver.com/mnews/article/057/0001854742?sid=102,"【 앵커멘트 】동덕여대 인근의 서울여대도 극심한 학내 갈등이 이어지고 있습니다.성폭력 의혹이 제기된 교수가 대자보로 자신을 비판한 학생들을 고소하고 나선 건데, 450명의 학생들이 경찰을 찾아 규탄 집회를 열었습니다.이어서 안정모 기자입니다.【 기자 】(현장음)-""성추행은 겨우 감봉, 대자보는 경찰 고소! 고소당한 대자보에 틀린 말 하나없다!""모자와 마스크를 착용한 서울여대 재학생 450명이 경찰서 앞에서 항의 집회를 열었습니다.지난해 성비위 의혹으로 징계를 받은 서울여대 A 교수가 대자보로 자신을 비판한 학생을 고소하자 학생들이 반발에 나선 겁니다.이들은 무혐의 종결을 촉구한 뒤 캠퍼스로 자리를 옮겨 30분 간 규탄 행진을 이어갔습니다.▶ 인터뷰 : 서울여대 재학생- ""학교 측에서 해임이라든지 다른 처벌이라든지 그런 걸 다시 하셨으면 좋겠습니다.""일부 학생들이 학교 건물에 래커를 칠하는 등 집단 행동에 나선 가운데 대학 측은 시설물 훼손 행위에 대해 손해배상을 청구하겠다며 강경대응 방침을 밝혔습니다.서울여대 교수평의회는 ""총장이 우선해야할 일은 공공 시설물 훼손에 대한 경고가 아니다""라며 신속하게 공식 논의와 조치 방향을 마련해야 한다고 촉구했습니다.▶ 스탠딩 : 안정모 / 기자- ""대학 측은 A 교수에 대한 추가징계 논의 등 대책 마련에 나섰는데 재학생들은 해임을 요구하고 있어 사태는 장기화할 전망입니다. MBN 뉴스 안정모입니다. ""영상취재 :김영진 기자영상편집 :오혜진그래픽 :  박경희",0.0,0,부정,"['【', '앵커멘트', '】동덕여대', '인근', '의', '서울여대', '도', '극심한', '학내', '가', 'ㄹ', '등', '이', '잇', '어', '지', '고', '있', '습니다', '.', '성폭력', '의혹', '이', '제기', '되', 'ㄴ', '교수', '가', '대자보', '로', '자신', '을', '비판', '하', 'ㄴ', '학생들', '을', '고소', '하고', '나서', 'ㄴ', '것', '이', 'ㄴ데', ',', '450명', '의', '학생들', '이', '경찰', '을', '찾', '아', '규탄', '집회', '를', '열', '었습니다', '.', '이', '이', '어서', '안정모', '기자', '이', 'ㅂ니다', '.', '【', '기', '이', '자', '】(현장음)-""성추행', '은', '겨우', '감봉', ',', '대자보', '는', '경찰', '고소', '!', '고소', '당하', 'ㄴ', '대자보', '에', '틀리', 'ㄴ', '말', '하나없', '다', '!""', '모자', '와', '마스크', '를', '착용', '하', 'ㄴ', '서울여대', '재학생', '450명', '이', '경찰', '서', '앞', '에서', '항의', '집회', '를', '열', '었습니다', '.', '지난해', '성비위', '의혹', '으로', '징계', '를', '받', '은', '서울여대', 'A', '교수', '가', '대자보', '로', '자신', '을', '비판', '하', 'ㄴ', '학생', '을', '고소하자', '학생들', '이', '반발', '에', '나서', 'ㄴ', '거', 'ㅂ니다', '.', '이', '들', '은', '무혐의', '종결', '을', '촉구', '하', 'ㄴ', '뒤', '캠퍼스', '로', '자리', '를', '옮기', '어', '30분', '가', 'ㄴ', '규탄', '행진', '을', '잇', '어', '가', '아ㅂ니다', '.', '▶', '인터뷰', ':', '서울여대', '재학생', '-', '""', '학교', '측', '에서', '해', '이', 'ㅁ', '이', '라', '든지', '다르', 'ㄴ', '처벌', '이', '라', '든지', '그러', 'ㄴ', '거', 'ㄹ', '다시', '하', '셨으면', '좋', '겠습니다', '.""', '일부', '학생들', '이', '학교', '건물', '에', '래커', '를', '칠하', '는', '등', '집단', '행동', '에', '나서', 'ㄴ', '가운데', '대학', '측은', '시설물', '훼손', '행위', '에', '대', '어', '하', '어', '손해배상', '을', '청구', '하', '겠다며', '강경대응', '방침', '을', '밝히', '었습니다', '.', '서울여대', '교수평의회', '는', '""', '총장', '이', '우선', '하', '어야', '하', 'ㄹ', '일', '은', '공공', '시설물', '훼손', '에', '대하', 'ㄴ', '경고', '가', '아니', '다', '""', '라며', '신속', '하', '게', '공식', '논의', '와', '조치', '방향', '을', '마련', '하', '어야', '하', 'ㄴ다', '고', '촉구', '하', '었습니다', '.', '▶', '스탠딩', ':', '안정모', '/', '기', '이', '자', '-', '""', '대학', '측은', 'A', '교수', '에', '대하', 'ㄴ', '추가징계', '논', '의', '등', '대책', '마련', '에', '나서', '었는데', '재학생들', '은', '해', '이', 'ㅁ', '을', '요구', '하고', '있', '어', '사태', '는', '장기', '화하', 'ㄹ', '전망', '이', 'ㅂ니다', '.', 'MBN', '뉴스', '안정모', '이', 'ㅂ니다', '.', '""', '영상취재', ':김영진', '기자영상편집', ':오혜진그래픽', ':', '박경희']"
